{"schema_version":"1.0.0","producer_namespace":"acme/records","producer_ref":"records-team","occurrence_id":"O-001","policy_fingerprint":"sha256:cccccccccccccccccccccccccccccccccccccccccccccccccccccccccccccccc","trigger":"creation","subject":{"kind":"receipt","fingerprint":"sha256:aaaaaaaaaaaaaaaaaaaaaaaaaaaaaaaaaaaaaaaaaaaaaaaaaaaaaaaaaaaaaaaa"},"occurred_at":"2026-09-24T10:00:00Z","declared_at":"2026-09-24T10:03:00Z"}
